{"$schema":"https://json-schema.org/draft/2020-12/schema","$id":"https://juanenrac.github.io/hydra-umc-sdk/contracts/v1/scenario-outcome.schema.json","title":"ScenarioOutcome","description":"One run of a fixed reproduction scenario, before or after a candidate fix. The shared T07/I60 shape: a stable scenario_id + repro_case identify WHAT is being reproduced, run_id + base_fingerprint pin THIS execution to a specific source state, and observed records what actually happened. compare_runs() turns a before/after pair into a verdict and, crucially, refuses to call it fixed when the base never moved or the after-run's evidence is for a different repro case.","type":"object","required":["schema_version","scenario_id","run_id","base_fingerprint","phase","repro_case","observed","timestamp_utc"],"properties":{"schema_version":{"const":"1.0"},"scenario_id":{"type":"string","minLength":1,"description":"Stable identity of the reproduction scenario itself - the same across every before/after run of it."},"run_id":{"type":"string","minLength":1,"description":"Identity of this one execution."},"base_fingerprint":{"type":"string","minLength":1,"description":"Opaque fingerprint of the exact source state this run was executed against."},"phase":{"enum":["before","after"],"description":"Whether this run was taken before or after the candidate fix."},"repro_case":{"type":"string","minLength":1,"description":"Which specific failure case this run exercises - part of the identity a fixed result must not silently change."},"observed":{"type":"object","required":["outcome"],"properties":{"outcome":{"enum":["reproduced","not-reproduced","error"]},"exit_code":{"type":"integer"},"evidence":{"type":"string"}},"additionalProperties":true},"timestamp_utc":{"type":"string","format":"date-time"}},"additionalProperties":true}
