{"schema_version":"1.0","scenario_id":"dev-server/I60/apparent-success","run_id":"run-2f9a","base_fingerprint":"a1b2c3d4","phase":"after","repro_case":"base-moved-mid-cycle","observed":{"outcome":"not-reproduced","exit_code":0,"evidence":"regression suite green, post-install verification passed"},"timestamp_utc":"2026-01-02T09:15:00Z"}
